{
  "_id": "TCGA:2018-04-05_PRAD_P_OncodriveFM",
  "_schema": "https://w3id.org/openebench/scientific-schemas/2.0/Dataset",
  "challenge_ids": [
    "TCGA:2018-04-05_PRAD"
  ],
  "community_ids": [
    "OEBC001"
  ],
  "dataset_contact_ids": [
    "orcid:0000-0001-7053-7717"
  ],
  "participant_team_id": "TCGA:2018-04-05_team_OncodriveFM",
  "dates": {
    "creation": "2018-04-05T00:00:00Z",
    "modification": "2018-04-05T14:00:00Z"
  },
  "depends_on": {
    "rel_dataset_ids": [
      {
        "dataset_id": "TCGA:2018-04-05_input"
      }
    ],
    "tool_id": "TCGA:OncodriveFM"
  },
  "description": "List of Cancer Driver Genes predicted by tool OncodriveFM in Prostate Adenocarcinoma",
  "name": "Cancer Driver Genes in Prostate Adenocarcinoma",
  "type": "participant",
  "version": "unknown",
  "visibility": "public",
  "datalinks": [
    {
      "attrs": [
        "archive"
      ],
      "uri": "https://api.gdc.cancer.gov/data/12c99bfe-ec49-4c99-994a-1000a33280c9",
      "validations": [
        {
          "validation_stamp": "2018-04-05T00:00:00Z",
          "status": "ok"
        }
      ]
    }
  ]
}
