{
  "_id": "QfO:2011-07-07_G_STD_Vertebrata_M",
  "_schema": "https://w3id.org/openebench/scientific-schemas/2.0/Dataset",
  "challenge_ids": [
    "QfO:2011-07-07_G_STD_Vertebrata"
  ],
  "community_ids": [
    "OEBC002"
  ],
  "dataset_contact_ids": [
    "orcid:0000-0002-2170-853X",
    "orcid:0000-0002-9074-3507",
    "orcid:0000-0003-0019-1735",
    "orcid:0000-0002-9015-5588"
  ],
  "dates": {
    "creation": "2011-07-07T00:00:00Z",
    "modification": "2011-07-07T14:00:00Z"
  },
  "depends_on": {
    "rel_dataset_ids": [
      {
        "dataset_id": "QfO:2011-07-07_I"
      }
    ]
  },
  "description": "Vertebrata Species Tree that can be used in the Generalized Species Tree Discordance benchmark as reference to assess the accuracy of orthologs predicted",
  "name": "Metrics Reference Dataset for Generalized Species Tree Discordance in Vertebrata benchmark",
  "type": "metrics_reference",
  "version": "unknown",
  "visibility": "community",
  "datalinks": [
    {
      "attrs": [
        "archive"
      ],
      "uri": "http://orthology.benchmarkservice.org",
      "validations": [
        {
          "validation_stamp": "2011-07-07T00:00:00Z",
          "status": "ok"
        }
      ]
    }
  ]
}
