{
  "_id": "TCGA:2018-04-05_LUSC_P_OncodriveCLUST",
  "_schema": "https://w3id.org/openebench/scientific-schemas/2.0/Dataset",
  "challenge_ids": [
    "TCGA:2018-04-05_LUSC"
  ],
  "community_ids": [
    "OEBC001"
  ],
  "dataset_contact_ids": [
    "orcid:0000-0002-7218-2806"
  ],
  "participant_team_id": "TCGA:2018-04-05_team_OncodriveCLUST",
  "dates": {
    "creation": "2018-04-05T00:00:00Z",
    "modification": "2018-04-05T14:00:00Z"
  },
  "depends_on": {
    "rel_dataset_ids": [
      {
        "dataset_id": "TCGA:2018-04-05_input"
      }
    ],
    "tool_id": "TCGA:OncodriveCLUST"
  },
  "description": "List of Cancer Driver Genes predicted by tool OncodriveCLUST in Lung Squamous Cell Carcinoma",
  "name": "Cancer Driver Genes in Lung Squamous Cell Carcinoma",
  "type": "participant",
  "version": "unknown",
  "visibility": "public",
  "datalinks": [
    {
      "attrs": [
        "archive"
      ],
      "uri": "https://api.gdc.cancer.gov/data/bea607fe-0d7e-4a7a-a839-84f5ba0ee4ff",
      "validations": [
        {
          "validation_stamp": "2018-04-05T00:00:00Z",
          "status": "ok"
        }
      ]
    }
  ]
}
