{
  "_id": "TCGA:2018-04-05_LIHC_P_compositeDriver",
  "_schema": "https://w3id.org/openebench/scientific-schemas/2.0/Dataset",
  "challenge_ids": [
    "TCGA:2018-04-05_LIHC"
  ],
  "community_ids": [
    "OEBC001"
  ],
  "dataset_contact_ids": [
    "orcid:0000-0003-4526-9727"
  ],
  "participant_team_id": "TCGA:2018-04-05_team_compositeDriver",
  "dates": {
    "creation": "2018-04-05T00:00:00Z",
    "modification": "2018-04-05T14:00:00Z"
  },
  "depends_on": {
    "rel_dataset_ids": [
      {
        "dataset_id": "TCGA:2018-04-05_input"
      }
    ],
    "tool_id": "TCGA:compositeDriver"
  },
  "description": "List of Cancer Driver Genes predicted by tool compositeDriver in Liver Hepatocellular Carcinoma",
  "name": "Cancer Driver Genes in Liver Hepatocellular Carcinoma",
  "type": "participant",
  "version": "unknown",
  "visibility": "public",
  "datalinks": [
    {
      "attrs": [
        "archive"
      ],
      "uri": "https://api.gdc.cancer.gov/data/bee64811-952a-4fac-b011-9cd28c0bd8d1",
      "validations": [
        {
          "validation_stamp": "2018-04-05T00:00:00Z",
          "status": "ok"
        }
      ]
    }
  ]
}
