{
  "_id": "TCGA:2018-04-05_SKCM_Aggregation",
  "_schema": "https://w3id.org/openebench/scientific-schemas/2.0/Dataset",
  "challenge_ids": [
    "TCGA:2018-04-05_SKCM"
  ],
  "community_ids": [
    "OEBC001"
  ],
  "dataset_contact_ids": [
    "orcid:0000-0001-7900-4239",
    "orcid:0000-0003-4526-9727",
    "orcid:0000-0003-1395-5378",
    "orcid:0000-0001-7053-7717",
    "orcid:0000-0002-2299-2309",
    "orcid:0000-0002-7218-2806",
    "orcid:0000-0002-1825-0090"
  ],
  "dates": {
    "creation": "2018-04-05T00:00:00Z",
    "modification": "2018-04-05T14:00:00Z"
  },
  "depends_on": {
    "rel_dataset_ids": [
      {
        "dataset_id": "TCGA:2018-04-05_SKCM_A_TPR_MutSig2CV"
      },
      {
        "dataset_id": "TCGA:2018-04-05_SKCM_A_precision_MutSig2CV"
      },
      {
        "dataset_id": "TCGA:2018-04-05_SKCM_A_TPR_compositeDriver"
      },
      {
        "dataset_id": "TCGA:2018-04-05_SKCM_A_precision_compositeDriver"
      },
      {
        "dataset_id": "TCGA:2018-04-05_SKCM_A_TPR_2020plus"
      },
      {
        "dataset_id": "TCGA:2018-04-05_SKCM_A_precision_2020plus"
      },
      {
        "dataset_id": "TCGA:2018-04-05_SKCM_A_TPR_OncodriveFM"
      },
      {
        "dataset_id": "TCGA:2018-04-05_SKCM_A_precision_OncodriveFM"
      },
      {
        "dataset_id": "TCGA:2018-04-05_SKCM_A_TPR_ActiveDriver"
      },
      {
        "dataset_id": "TCGA:2018-04-05_SKCM_A_precision_ActiveDriver"
      },
      {
        "dataset_id": "TCGA:2018-04-05_SKCM_A_TPR_e-Driver"
      },
      {
        "dataset_id": "TCGA:2018-04-05_SKCM_A_precision_e-Driver"
      },
      {
        "dataset_id": "TCGA:2018-04-05_SKCM_A_TPR_OncodriveCLUST"
      },
      {
        "dataset_id": "TCGA:2018-04-05_SKCM_A_precision_OncodriveCLUST"
      },
      {
        "dataset_id": "TCGA:2018-04-05_SKCM_A_TPR_MuSiC"
      },
      {
        "dataset_id": "TCGA:2018-04-05_SKCM_A_precision_MuSiC"
      },
      {
        "dataset_id": "TCGA:2018-04-05_input"
      },
      {
        "dataset_id": "TCGA:2018-04-05_SKCM_M"
      }
    ],
    "representation_id": "TCGA:aggregation",
    "tool_id": "TCGA:aggregate_benchmark"
  },
  "description": "Summary dataset with information about challenge Skin Cutaneous Melanoma (e.g. input/output datasets, metrics...) in participant MuSiC",
  "name": "Summary dataset for challenge: Skin Cutaneous Melanoma",
  "type": "aggregation",
  "version": "unknown",
  "visibility": "public",
  "datalinks": [
    {
      "inline_data": {
        "challenge_participants": [
          {
            "metric_x": 0.7916666666666666,
            "metric_y": 0.6333333333333333,
            "tool_id": "TCGA:MutSig2CV"
          },
          {
            "metric_x": 0.375,
            "metric_y": 0.2903225806451613,
            "tool_id": "TCGA:compositeDriver"
          },
          {
            "metric_x": 0.9583333333333334,
            "metric_y": 0.10849056603773585,
            "tool_id": "TCGA:2020plus"
          },
          {
            "metric_x": 0.5833333333333334,
            "metric_y": 0.06278026905829596,
            "tool_id": "TCGA:OncodriveFM"
          },
          {
            "metric_x": 0.20833333333333334,
            "metric_y": 0.17857142857142858,
            "tool_id": "TCGA:ActiveDriver"
          },
          {
            "metric_x": 0.20833333333333334,
            "metric_y": 0.25,
            "tool_id": "TCGA:e-Driver"
          },
          {
            "metric_x": 0.3333333333333333,
            "metric_y": 0.06153846153846154,
            "tool_id": "TCGA:OncodriveCLUST"
          },
          {
            "metric_x": 0.2916666666666667,
            "metric_y": 0.4117647058823529,
            "tool_id": "TCGA:MuSiC"
          }
        ],
        "visualization": {
          "type": "2D-plot",
          "x_axis": "OEBM0020000002",
          "y_axis": "OEBM0020000001"
        }
      },
      "schema_url": "https://raw.githubusercontent.com/inab/OpenEBench_scientific_visualizer/js/benchmarking_data_model/inline_data_visualizer.json"
    }
  ]
}
