{
  "_id": "QfO:2011-07-07_STD_Fungi_A_STD_RF_distance_MetaPhOrs",
  "_schema": "https://w3id.org/openebench/scientific-schemas/2.0/Dataset",
  "challenge_ids": [
    "QfO:2011-07-07_STD_Fungi"
  ],
  "community_ids": [
    "OEBC002"
  ],
  "dataset_contact_ids": [
    "orcid:0000-0002-2170-853X",
    "orcid:0000-0002-9074-3507",
    "orcid:0000-0003-0019-1735",
    "orcid:0000-0002-9015-5588"
  ],
  "dates": {
    "creation": "2011-07-07T00:00:00Z",
    "modification": "2011-07-07T14:00:00Z"
  },
  "depends_on": {
    "metrics_id": "QfO:STD_RF_distance",
    "rel_dataset_ids": [
      {
        "dataset_id": "QfO:2011-07-07_P_MetaPhOrs"
      },
      {
        "dataset_id": "QfO:2011-07-07_STD_Fungi_M"
      }
    ],
    "tool_id": "QfO:MetaPhOrs"
  },
  "description": "Assessment dataset for applying Metric 'STD_RF_distance' to MetaPhOrs predictions in Species Tree Discordance in Fungi",
  "name": "Assesment of STD_RF_distance in MetaPhOrs",
  "type": "assessment",
  "version": "1",
  "visibility": "public",
  "datalinks": [
    {
      "inline_data": {
        "error": "0.013097",
        "value": "0.255859"
      }
    }
  ]
}
