{
  "_id": "TCGA:2018-04-05_DLBC_P_MutSig2CV",
  "_schema": "https://w3id.org/openebench/scientific-schemas/2.0/Dataset",
  "challenge_ids": [
    "TCGA:2018-04-05_DLBC"
  ],
  "community_ids": [
    "OEBC001"
  ],
  "dataset_contact_ids": [
    "orcid:0000-0001-7900-4239"
  ],
  "participant_team_id": "TCGA:2018-04-05_team_MutSig2CV",
  "dates": {
    "creation": "2018-04-05T00:00:00Z",
    "modification": "2018-04-05T14:00:00Z"
  },
  "depends_on": {
    "rel_dataset_ids": [
      {
        "dataset_id": "TCGA:2018-04-05_input"
      }
    ],
    "tool_id": "TCGA:MutSig2CV"
  },
  "description": "List of Cancer Driver Genes predicted by tool MutSig2CV in Lymphoid Neoplasm Diffuse Large B-cell Lymphoma",
  "name": "Cancer Driver Genes in Lymphoid Neoplasm Diffuse Large B-cell Lymphoma",
  "type": "participant",
  "version": "unknown",
  "visibility": "public",
  "datalinks": [
    {
      "attrs": [
        "archive"
      ],
      "uri": "https://api.gdc.cancer.gov/data/2e8d4650-5498-4288-a461-23667ff553e2",
      "validations": [
        {
          "validation_stamp": "2018-04-05T00:00:00Z",
          "status": "ok"
        }
      ]
    }
  ]
}
