{
  "_id": "TCGA:2018-04-05_LAML_M",
  "_schema": "https://w3id.org/openebench/scientific-schemas/2.0/Dataset",
  "challenge_ids": [
    "TCGA:2018-04-05_LAML"
  ],
  "community_ids": [
    "OEBC001"
  ],
  "dataset_contact_ids": [
    "orcid:0000-0003-4526-9727",
    "orcid:0000-0001-7900-4239",
    "orcid:0000-0003-1395-5378"
  ],
  "dates": {
    "creation": "2018-04-05T00:00:00Z",
    "modification": "2018-04-05T14:00:00Z"
  },
  "depends_on": {
    "rel_dataset_ids": [
      {
        "dataset_id": "TCGA:2018-04-05_input"
      }
    ]
  },
  "description": "List of genes (described by TCGA community) that can be used as 'gold standard' in Acute Myeloid Leukemia benchmark ",
  "name": "Metrics Reference Dataset for Acute Myeloid Leukemia",
  "type": "metrics_reference",
  "version": "unknown",
  "visibility": "public",
  "datalinks": [
    {
      "attrs": [
        "archive"
      ],
      "uri": "https://portal.gdc.cancer.gov/",
      "validations": [
        {
          "validation_stamp": "2018-04-05T00:00:00Z",
          "status": "ok"
        }
      ]
    }
  ]
}
