{
  "_id": "TCGA:2018-04-05_KIRP_P_MuSiC",
  "_schema": "https://w3id.org/openebench/scientific-schemas/2.0/Dataset",
  "challenge_ids": [
    "TCGA:2018-04-05_KIRP"
  ],
  "community_ids": [
    "OEBC001"
  ],
  "dataset_contact_ids": [
    "orcid:0000-0002-1825-0090"
  ],
  "participant_team_id": "TCGA:2018-04-05_team_MuSiC",
  "dates": {
    "creation": "2018-04-05T00:00:00Z",
    "modification": "2018-04-05T14:00:00Z"
  },
  "depends_on": {
    "rel_dataset_ids": [
      {
        "dataset_id": "TCGA:2018-04-05_input"
      }
    ],
    "tool_id": "TCGA:MuSiC"
  },
  "description": "List of Cancer Driver Genes predicted by tool MuSiC in Kidney Renal Papillary Cell Carcinoma",
  "name": "Cancer Driver Genes in Kidney Renal Papillary Cell Carcinoma",
  "type": "participant",
  "version": "unknown",
  "visibility": "public",
  "datalinks": [
    {
      "attrs": [
        "archive"
      ],
      "uri": "https://api.gdc.cancer.gov/data/3b75b24b-4618-48bb-89fd-1bcae54934d7",
      "validations": [
        {
          "validation_stamp": "2018-04-05T00:00:00Z",
          "status": "ok"
        }
      ]
    }
  ]
}
