{
  "_id": "QfO:2011-07-07_P_MetaPhOrs",
  "_schema": "https://w3id.org/openebench/scientific-schemas/2.0/Dataset",
  "challenge_ids": [
    "QfO:2011-07-07_SwissTree",
    "QfO:2011-07-07_STD_Fungi",
    "QfO:2011-07-07_STD_Eukaryota",
    "QfO:2011-07-07_GOtest",
    "QfO:2011-07-07_TreeFam-A",
    "QfO:2011-07-07_G_STD_Fungi",
    "QfO:2011-07-07_G_STD_Eukaryota",
    "QfO:2011-07-07_G_STD_LUCA",
    "QfO:2011-07-07_G_STD_Vertebrata",
    "QfO:2011-07-07_ECtest"
  ],
  "community_ids": [
    "OEBC002"
  ],
  "dataset_contact_ids": [
    "orcid:0000-0002-2170-853X"
  ],
  "participant_team_id": "QfO:2011-07-07_team_MetaPhOrs",
  "dates": {
    "creation": "2011-07-07T00:00:00Z",
    "modification": "2011-07-07T14:00:00Z"
  },
  "depends_on": {
    "rel_dataset_ids": [
      {
        "dataset_id": "QfO:2011-07-07_I"
      }
    ],
    "tool_id": "QfO:MetaPhOrs"
  },
  "description": "List of orthologs pairs predicted by MetaPhOrs using the Quest for Orthologs reference proteome",
  "name": "Orthologs predicted by MetaPhOrs",
  "type": "participant",
  "version": "unknown",
  "visibility": "public",
  "datalinks": [
    {
      "attrs": [
        "archive"
      ],
      "uri": "https://orthology.benchmarkservice.org/raw/metaPhOrs-.506.rels.raw.gz",
      "validations": [
        {
          "validation_stamp": "2011-07-07T00:00:00Z",
          "status": "ok"
        }
      ]
    }
  ]
}
