{
  "_id": "TCGA:2018-04-05_LAML_A_precision_e-Driver",
  "_schema": "https://w3id.org/openebench/scientific-schemas/2.0/Dataset",
  "challenge_ids": [
    "TCGA:2018-04-05_LAML"
  ],
  "community_ids": [
    "OEBC001"
  ],
  "dataset_contact_ids": [
    "orcid:0000-0001-7900-4239"
  ],
  "dates": {
    "creation": "2018-04-05T00:00:00Z",
    "modification": "2018-04-05T14:00:00Z"
  },
  "depends_on": {
    "metrics_id": "TCGA:precision",
    "rel_dataset_ids": [
      {
        "dataset_id": "TCGA:2018-04-05_LAML_P_e-Driver"
      },
      {
        "dataset_id": "TCGA:2018-04-05_LAML_M"
      }
    ],
    "tool_id": "TCGA:e-Driver"
  },
  "description": "Assessment dataset for applying Metric 'Positive Predictive Value' to e-Driver predictions in Acute Myeloid Leukemia",
  "name": "Assesment of Metric precision-PPV in e-Driver",
  "type": "assessment",
  "version": "1",
  "visibility": "public",
  "datalinks": [
    {
      "inline_data": {
        "value": 0
      }
    }
  ]
}
