{
  "_id": "TCGA:2018-04-05_THYM_P_ActiveDriver",
  "_schema": "https://w3id.org/openebench/scientific-schemas/2.0/Dataset",
  "challenge_ids": [
    "TCGA:2018-04-05_THYM"
  ],
  "community_ids": [
    "OEBC001"
  ],
  "dataset_contact_ids": [
    "orcid:0000-0002-2299-2309"
  ],
  "participant_team_id": "TCGA:2018-04-05_team_ActiveDriver",
  "dates": {
    "creation": "2018-04-05T00:00:00Z",
    "modification": "2018-04-05T14:00:00Z"
  },
  "depends_on": {
    "rel_dataset_ids": [
      {
        "dataset_id": "TCGA:2018-04-05_input"
      }
    ],
    "tool_id": "TCGA:ActiveDriver"
  },
  "description": "List of Cancer Driver Genes predicted by tool ActiveDriver in Thymoma",
  "name": "Cancer Driver Genes in Thymoma",
  "type": "participant",
  "version": "unknown",
  "visibility": "public",
  "datalinks": [
    {
      "attrs": [
        "archive"
      ],
      "uri": "https://api.gdc.cancer.gov/data/357d9cf5-b0ee-4a6e-851f-a58ff9ec716d",
      "validations": [
        {
          "validation_stamp": "2018-04-05T00:00:00Z",
          "status": "ok"
        }
      ]
    }
  ]
}
